[
  {
    "model": "gpt-4o",
    "understanding": "Мир реагирует на помощь: отношения с общиной укрепляются. Похоже, у мира есть скрытые процессы, о которых игрок узнаёт по последствиям.",
    "missingInfo": ["Не видно других способов помощи", "Неясно, как влияет погода"],
    "interfaceIssues": ["Непонятно, почему караван исчез", "Сырое имя цели в тексте"],
    "improvements": ["Показывать связь между действием и реакцией мира"],
    "expectedNextEvents": ["Отношения продолжат расти", "Погода изменится"]
  },
  {
    "model": "claude-3-7",
    "understanding": "Игрок помогает общине, и мир отвечает сменой отношений. Есть фоновые процессы (погода).",
    "missingInfo": ["Что за караван и куда он шёл?", "Сколько осталось до исхода"],
    "interfaceIssues": ["Непонятно, почему караван исчез", "Нет индикатора времени"],
    "improvements": ["Добавить контекст о событиях мира", "Показывать причины изменений"],
    "expectedNextEvents": ["Придёт новый караван", "Погода изменится"]
  },
  {
    "model": "gemini-2.5",
    "understanding": "Социальные действия влияют на отношения с общиной; мир живёт и без игрока.",
    "missingInfo": ["Неизвестно местоположение игрока на карте"],
    "interfaceIssues": ["Непонятно, почему караван исчез"],
    "improvements": ["Улучшить читаемость журнала"],
    "expectedNextEvents": ["Ничего конкретного"]
  }
]
